{
  "_schema": "calendar",
  "_id": "3fa85f64-5717-4562-b3fc-2c963f66afa6",
  "_org": "123",
  "_title": "Entity Title",
  "_tags": [
    "family:label"
  ],
  "name": "string",
  "description": "string",
  "color": "string",
  "is_default": true,
  "read_only": true,
  "owner_email": "user@example.com",
  "owner": {
    "id": "string",
    "organization_id": "123",
    "email": "user@example.com",
    "display_name": "John Doe",
    "name": "John Doe",
    "preferred_language": "de",
    "signature": "<p>Best regards,<br/>John Doe</p>",
    "roles": [
      "Owner"
    ],
    "image_uri": {
      "original": "https://account-profile-images.epilot.cloud/1/avatar.png",
      "thumbnail_32": "https://account-profile-images.epilot.cloud/1/avatar_32x32.png"
    },
    "properties": [
      {
        "name": "profileImageName",
        "value": "avatar.png"
      }
    ]
  },
  "source_type": "native",
  "source_provider": "outlook",
  "provider_calendar_id": "string",
  "last_synced_at": "1970-01-01T00:00:00.000Z",
  "_files": {
    "$relation": [
      {
        "entity_id": "123e4567-e89b-12d3-a456-426614174000",
        "_tags": [
          "example"
        ]
      }
    ]
  },
  "_created_at": "1970-01-01T00:00:00.000Z",
  "_updated_at": "1970-01-01T00:00:00.000Z",
  "_owners": [
    {
      "org_id": "123",
      "user_id": "456"
    }
  ],
  "_acl": {
    "view": [
      "org:456"
    ],
    "edit": [
      "org:456"
    ],
    "delete": [
      "org:456"
    ]
  },
  "_manifest": [
    "123e4567-e89b-12d3-a456-426614174000"
  ]
}